{
	"nameShort": "Flauz",
	"nameLong": "Flauz",
	"version": "0.2.0",
	"applicationName": "flauz",
	"dataFolderName": ".flauz",
	"sharedDataFolderName": ".flauz-shared",
	"win32MutexName": "flauz",
	"win32DirName": "Flauz",
	"win32NameVersion": "Flauz",
	"win32RegValueName": "Flauz",
	"win32AppUserModelId": "Flauz.Flauz",
	"win32ShellNameShort": "Flauz",
	"win32TunnelServiceMutex": "flauz-tunnelservice",
	"win32TunnelMutex": "flauz-tunnel",
	"serverApplicationName": "flauz-server",
	"serverDataFolderName": ".flauz-server",
	"tunnelApplicationName": "flauz-tunnel",
	"darwinBundleIdentifier": "flauz.flauz",
	"linuxDesktopName": "flauz.flauz",
	"linuxIconName": "flauz",
	"urlProtocol": "flauz",
	"reportIssueUrl": "https://github.com/payswapdotorg/Flauz/issues/new",
	"extensionEnabledApiProposals": {
		"flauz.flauz-agent": [
			"defaultChatParticipant",
			"chatParticipantAdditions"
		],
		"flauz.flauz-workspace": [
			"scmArtifactProvider"
		],
		"flauz.flauz-browser": [
			"browser"
		],
		"flauz.flauz-environments": [
			"resolvers"
		]
	},
	"defaultChatAgent": null,
	"builtInExtensionsEnabledWithAutoUpdates": [],
	"trustedExtensionAuthAccess": {
		"github": null,
		"github-enterprise": null
	}
}
